{
  "schema_version": "1.0",
  "scope_ref": "scope:fixture",
  "package_ref": {
    "id": "kb:fixture",
    "revision": 1
  },
  "id": "validation:scope:fixture",
  "inputs": [
    {
      "kind": "business-rules",
      "id": "rules:fixture",
      "content_hash": "9e96cc4d4b19c9252af2cb493ce582299185b14dec9e5c10119b9fd4fcc04ed6"
    },
    {
      "kind": "domain-tree",
      "id": "tree:fixture",
      "content_hash": "c18d7ae66560ad52e2d711555eeb9ec64152b77e5b23f7ce3d73bd27ccba2705"
    },
    {
      "kind": "knowledge",
      "id": "kb:fixture",
      "content_hash": "7165e821c822d6bcee3f1771fe814b7ca2a6210e7a9bd8b27f2ad7d932147e06"
    },
    {
      "kind": "scenario",
      "id": "scenario-output:fixture",
      "content_hash": "0c075a63557bb2ffbe13293adceaa6e380f808d41aa590211849e3e2a005ca13"
    },
    {
      "kind": "scenario-definition",
      "id": "definition:fixture",
      "content_hash": "759709cd9d58258567208c9be471124786c594253d499255579e127cb79e3c73"
    },
    {
      "kind": "source-map",
      "id": "source-map:fixture",
      "content_hash": "652366ae58530204c001cf47b5e2ed5e7a55330023507185df4b9fee3f16ae8e"
    },
    {
      "kind": "technical-flow",
      "id": "flow:fixture",
      "content_hash": "c32b6ffedce48f35f49b97c7848d24a83e95cbf4c85d71b37982b506d987d213"
    }
  ],
  "claim_inventory": [
    "claim:actors",
    "claim:anchor",
    "claim:business_goal",
    "claim:edge",
    "claim:edge:0",
    "claim:edge:0:condition",
    "claim:edge:1",
    "claim:edge:1:condition",
    "claim:entry_state",
    "claim:exit_states",
    "claim:expected_outcomes",
    "claim:flow-implementation",
    "claim:flow:alternative",
    "claim:flow:alternative:type",
    "claim:flow:main",
    "claim:flow:main:type",
    "claim:rule:affected_actor:0",
    "claim:rule:affected_scenario:0",
    "claim:rule:condition",
    "claim:rule:false_result",
    "claim:rule:implementation:0",
    "claim:rule:parameters:0",
    "claim:rule:rule_kind",
    "claim:rule:rule_statement",
    "claim:rule:true_result",
    "claim:scenario-step:guard:action",
    "claim:scenario-step:guard:decision_kind",
    "claim:scenario-step:guard:decision_ref",
    "claim:scenario-step:guard:evaluated_rules:0",
    "claim:scenario-step:guard:implementation:0",
    "claim:scenario-step:guard:kind",
    "claim:scenario-step:guard:na:actor",
    "claim:scenario-step:guard:na:integrations",
    "claim:scenario-step:guard:system_behavior",
    "claim:scenario-step:return-one:action",
    "claim:scenario-step:return-one:implementation:0",
    "claim:scenario-step:return-one:kind",
    "claim:scenario-step:return-one:na:actor",
    "claim:scenario-step:return-one:na:evaluated_rules",
    "claim:scenario-step:return-one:na:integrations",
    "claim:scenario-step:return-one:system_behavior",
    "claim:scenario-step:return-zero:action",
    "claim:scenario-step:return-zero:implementation:0",
    "claim:scenario-step:return-zero:kind",
    "claim:scenario-step:return-zero:na:actor",
    "claim:scenario-step:return-zero:na:evaluated_rules",
    "claim:scenario-step:return-zero:na:integrations",
    "claim:scenario-step:return-zero:system_behavior",
    "claim:technical:checks/0",
    "claim:technical:conditions/0",
    "claim:technical:inputs/0",
    "claim:technical:inputs/1",
    "claim:technical:outputs/0",
    "claim:technical:purpose",
    "claim:technical:symbol",
    "claim:technical:type",
    "claim:trigger",
    "claim:workflow:57",
    "claim:workflow:58",
    "claim:workflow:59",
    "claim:workflow:60",
    "claim:workflow:61",
    "claim:workflow:62",
    "claim:workflow:63",
    "claim:workflow:64",
    "claim:workflow:65",
    "claim:workflow:66",
    "claim:workflow:67",
    "claim:workflow:68",
    "claim:workflow:69",
    "claim:workflow:70",
    "claim:workflow:71",
    "claim:workflow:72",
    "claim:workflow:73",
    "claim:workflow:74",
    "claim:workflow:75",
    "claim:workflow:76",
    "claim:workflow:77",
    "claim:workflow:78",
    "claim:workflow:79",
    "claim:workflow:80",
    "claim:workflow:81",
    "claim:workflow:82",
    "claim:workflow:83",
    "claim:workflow:84"
  ],
  "claim_reviews": [
    {
      "claim_id": "claim:actors",
      "claim_hash": "7462f9b008db35fa9643e6a8be362f29c99b78a543c7122312fc4e4aec2f922b",
      "status": "CONFIRMED",
      "reviewed": true,
      "reason": "Synthetic inspected evidence for fixed fixture version.",
      "source_checks": [
        {
          "evidence_id": "evidence:fixture",
          "snapshot_id": "snapshot:fixture",
          "source_location": "fixtures/flow.cs:1",
          "version": "fixture-v1",
          "content_hash": "4bd7b55ee5ce1de563cee83b7bca75628c825b3443bb3ec545106d9f80763c91",
          "verification": "snapshot_only",
          "result": "SUPPORTS",
          "quote": "// Synthetic fixture: one goal = process the fixture request.\n// Trigger = FixtureCommand. Entry = fixture pending. Outcome = fixture done.\n// Actor = fixture client. No OSAGO business knowledge is asserted.\n// Synthetic technical main path: accuracy >= 7; alternative path: accuracy < 7.\nrecord FixtureCommand();\nclass FixtureHandler {\n    // Synthetic technical threshold, not an OSAGO business rule.\n    public int Handle(FixtureCommand command, int accuracy) {\n        if (accuracy < 7) return 0;\n        return 1;\n    }\n}\n// Registration: FixtureCommand -> FixtureHandler.Handle\n",
          "reason": "Synthetic check; semantic truth is not assessed by this test helper."
        }
      ],
      "supported_parts": [],
      "unsupported_parts": [],
      "comparison_ids": [],
      "conflict_ids": [],
      "gap_ids": [],
      "required_action": "none"
    },
    {
      "claim_id": "claim:anchor",
      "claim_hash": "0ece68f3f8504f56ad74cc6ea4df864616d68b78305a3326cc3192b4cbd3a7e5",
      "status": "CONFIRMED",
      "reviewed": true,
      "reason": "Synthetic inspected evidence for fixed fixture version.",
      "source_checks": [
        {
          "evidence_id": "evidence:fixture",
          "snapshot_id": "snapshot:fixture",
          "source_location": "fixtures/flow.cs:1",
          "version": "fixture-v1",
          "content_hash": "4bd7b55ee5ce1de563cee83b7bca75628c825b3443bb3ec545106d9f80763c91",
          "verification": "snapshot_only",
          "result": "SUPPORTS",
          "quote": "// Synthetic fixture: one goal = process the fixture request.\n// Trigger = FixtureCommand. Entry = fixture pending. Outcome = fixture done.\n// Actor = fixture client. No OSAGO business knowledge is asserted.\n// Synthetic technical main path: accuracy >= 7; alternative path: accuracy < 7.\nrecord FixtureCommand();\nclass FixtureHandler {\n    // Synthetic technical threshold, not an OSAGO business rule.\n    public int Handle(FixtureCommand command, int accuracy) {\n        if (accuracy < 7) return 0;\n        return 1;\n    }\n}\n// Registration: FixtureCommand -> FixtureHandler.Handle\n",
          "reason": "Synthetic check; semantic truth is not assessed by this test helper."
        }
      ],
      "supported_parts": [],
      "unsupported_parts": [],
      "comparison_ids": [],
      "conflict_ids": [],
      "gap_ids": [],
      "required_action": "none"
    },
    {
      "claim_id": "claim:business_goal",
      "claim_hash": "e4a181e0c000b13562cee55bdec22ebf99bcb209da69f6f1f387c9ba2730e7b7",
      "status": "CONFIRMED",
      "reviewed": true,
      "reason": "Synthetic inspected evidence for fixed fixture version.",
      "source_checks": [
        {
          "evidence_id": "evidence:fixture",
          "snapshot_id": "snapshot:fixture",
          "source_location": "fixtures/flow.cs:1",
          "version": "fixture-v1",
          "content_hash": "4bd7b55ee5ce1de563cee83b7bca75628c825b3443bb3ec545106d9f80763c91",
          "verification": "snapshot_only",
          "result": "SUPPORTS",
          "quote": "// Synthetic fixture: one goal = process the fixture request.\n// Trigger = FixtureCommand. Entry = fixture pending. Outcome = fixture done.\n// Actor = fixture client. No OSAGO business knowledge is asserted.\n// Synthetic technical main path: accuracy >= 7; alternative path: accuracy < 7.\nrecord FixtureCommand();\nclass FixtureHandler {\n    // Synthetic technical threshold, not an OSAGO business rule.\n    public int Handle(FixtureCommand command, int accuracy) {\n        if (accuracy < 7) return 0;\n        return 1;\n    }\n}\n// Registration: FixtureCommand -> FixtureHandler.Handle\n",
          "reason": "Synthetic check; semantic truth is not assessed by this test helper."
        }
      ],
      "supported_parts": [],
      "unsupported_parts": [],
      "comparison_ids": [],
      "conflict_ids": [],
      "gap_ids": [],
      "required_action": "none"
    },
    {
      "claim_id": "claim:edge",
      "claim_hash": "339687bb11086467e6e01a5930d305765adf03225492c1100e02dbd7cf250872",
      "status": "CONFIRMED",
      "reviewed": true,
      "reason": "Synthetic inspected evidence for fixed fixture version.",
      "source_checks": [
        {
          "evidence_id": "evidence:fixture",
          "snapshot_id": "snapshot:fixture",
          "source_location": "fixtures/flow.cs:1",
          "version": "fixture-v1",
          "content_hash": "4bd7b55ee5ce1de563cee83b7bca75628c825b3443bb3ec545106d9f80763c91",
          "verification": "snapshot_only",
          "result": "SUPPORTS",